{
  "artifact_id": "artifact-20261021-001",
  "work_id": "work-7f3a",
  "revision": 3,
  "digest": "ffffffffffffffffffffffffffffffffffffffffffffffffffffffffffffffff",
  "media_type": "text/markdown",
  "location": "/J.A.R.V.I.S./research/2026-10-21/report.md",
  "provenance": "research-bot, brief rev 3, workspace snapshot a1b2c3"
}
